{
  "id": "talent-match-assistant",
  "name": "Talent Match Assistant",
  "version": "2.0",
  "owner": "People Analytics",
  "role": "provider",
  "domain": "employment",
  "lifecycle_stage": "production",
  "intended_purpose": "Prioritise applications for recruiter review and draft evidence-grounded recommendation explanations.",
  "decision_impact": "Influences access to employment interviews.",
  "geographies": ["EU", "UK"],
  "capabilities": ["ranking", "automated_recommendation", "content_generation"],
  "risk_factors": ["fundamental_rights", "selection_bias", "generated_explanation"],
  "data_sensitivity": ["personal_data", "employment_history"],
  "affected_groups": ["job applicants", "recruiters"],
  "declared_risk_tier": "high",
  "vendor": "Example Foundation Model Provider",
  "deployment_date": "2027-01-20"
}
